{
  "schema": "rrkal.renderer_skin_asset.v0.2.2",
  "kind": "terrain",
  "asset_id": "terrain_synthetic_v0.2.2",
  "source_dataset": "SYNTHETIC_GENERATOR_V2",
  "source_fingerprint": "sha256:d6d8747864380a1555a1555a1555a1555a1555a1555a1555a1555a1555a1555a",
  "encoding": {
    "type": "int16_meter",
    "scale": 0.5,
    "offset": 0.0,
    "nodata_value": -32768
  },
  "projection": {
    "system": "EPSG:4326",
    "datum": "WGS84",
    "unit": "degree"
  },
  "grid": {
    "row_order": "south_to_north",
    "col_order": "west_to_east",
    "bounds_semantics": "grid_points_inclusive",
    "lon_wrap": "[-180,180]",
    "lat_index_formula": "row = (lat + 90) / 180 * (height - 1)",
    "lon_index_formula": "col = (lon + 180) / 360 * (width - 1)"
  },
  "bounds": {
    "lat_min": -90.0,
    "lat_max": 90.0,
    "lon_min": -180.0,
    "lon_max": 180.0
  },
  "limits": {
    "max_dimension": 65536,
    "max_levels": 12,
    "max_payload_bytes": 1073741824,
    "allow_pickle": false
  },
  "levels": [
    {
      "level": 0,
      "path": "payloads/elevation_l0_i16.npz",
      "shape": [
        180,
        360
      ],
      "cell_size_deg": 1.0,
      "raw_nbytes": 129600,
      "file_size_bytes": 86400,
      "compression": "npz_deflate",
      "valid_mask": "payloads/coverage/valid_elevation_mask_l0_u8.npz",
      "valid_mask_file_size_bytes": 64800,
      "land_fraction": "payloads/coverage/land_fraction_l0_u8.npz",
      "land_fraction_file_size_bytes": 64800,
      "water_fraction": "payloads/coverage/water_fraction_l0_u8.npz",
      "water_fraction_file_size_bytes": 64800,
      "minmax_path": "payloads/minmax_l0_i16.npz",
      "minmax_file_size_bytes": 256,
      "minmax_scope": "global_lod_summary"
    }
  ],
  "checksums": {
    "payloads/elevation_l0_i16.npz": "sha256:d6d8747864380a1555a1555a1555a1555a1555a1555a1555a1555a1555a1555a",
    "payloads/coverage/valid_elevation_mask_l0_u8.npz": "sha256:d6d8747864380a1555a1555a1555a1555a1555a1555a1555a1555a1555a1555a",
    "payloads/coverage/land_fraction_l0_u8.npz": "sha256:d6d8747864380a1555a1555a1555a1555a1555a1555a1555a1555a1555a1555a",
    "payloads/coverage/water_fraction_l0_u8.npz": "sha256:d6d8747864380a1555a1555a1555a1555a1555a1555a1555a1555a1555a1555a",
    "payloads/minmax_l0_i16.npz": "sha256:d6d8747864380a1555a1555a1555a1555a1555a1555a1555a1555a1555a1555a"
  },
  "status": "ready"
}
